{
  "interface_version": "1.0.0",
  "request_id": "req_lunch_box_001",
  "status": "partial",
  "evidence_mode": "mirror_assisted",
  "supplier_count": 3,
  "collected_supplier_names": [
    "Shitai / shitai stainless steel",
    "潮州市潮安区辛博尔不锈钢制品厂",
    "潮州市潮安区奔展不锈钢制品有限公司"
  ],
  "summary": "Codex adapter resolved the example request to a usable 3-supplier shortlist by reusing the repo's April 16 mirror-assisted live validation evidence, while preserving the documented direct-site failure boundary.",
  "blockers": [
    "direct 1688 page opening was not proven in the current validation environment"
  ],
  "limitations": [
    "this interop run reused existing validated evidence instead of performing a fresh direct-site browse",
    "supplier profile pages were not fully validated through direct 1688 access"
  ],
  "report_artifacts": {
    "report_markdown_ref": "examples/live-validation-2026-04-16-mirror-happy-path.md",
    "run_notes_ref": "examples/live-validation-2026-04-16-direct-site-failure.md"
  }
}
