{
  "interface_version": "1.0.0",
  "request_id": "req_lunch_box_001",
  "status": "blocked",
  "evidence_mode": "none",
  "summary": "Hermes launched a real browser-side validation run and entered live page navigation, but the session stalled during browser interactions and emitted no final report artifact.",
  "blockers": [
    "browser-side Hermes run stalled during live page interactions before producing a final report"
  ],
  "limitations": [
    "direct 1688 browser validation remains unproven in the Hermes host",
    "mirror fallback navigation started but did not complete to a stable readable report",
    "the raw stdout artifact is empty because the run emitted no final answer before termination"
  ],
  "report_artifacts": {
    "report_markdown_ref": "verification/hermes-browser-live-validation-2026-04-16.md",
    "run_notes_ref": "reports/hermes-browser-live-validation-2026-04-16.raw.txt"
  }
}
